{"$schema":"./run.schema.json","artifact_type":"DEVELOPMENT_ELICITATION_SCRIPTED_REPLAY","authority":{"artifact_role":"DEVELOPMENT_ELICITATION_SCRIPTED_REPLAY_ARTIFACT","defect_status":"NO_DEFECT_CLASSIFICATION_EMITTED","empirical_status":"NO_ACTUAL_PARTICIPANT_OCCURRENCE_OR_HUMAN_MECHANISM_SUPPORT","mapping_status":"NO_MAPPING_EMITTED","response_authority":"SCRIPTED_RESPONSE_RECORD_AND_PAYLOAD_PROVENANCE_ONLY"},"instrument_binding":{"content_sha256":"52705bc686a69d43360eb0544eda59571c77dc1e29520ec4b156bcd60f413776","instrument_id":"INTERP-DIALOGUE-001P0-ELICITATION-INSTRUMENT-V0","instrument_version":"0.0.0"},"run_id":"P1V0-RUN-0020","schema_version":"1.0.0","session_input_sha256":"d1e77b6573958d5fcca3fb4cf0aa3c888b31758096a11354e1575ec3e94cdec3","sessions":[{"comparison_binding":{"status":"NOT_APPLICABLE"},"event_log":[{"authority":"SCRIPTED_DELIVERY_RECORD_NOT_ACTUAL_OCCURRENCE_OR_ORDINAL_OBSERVATION","elicitation_step_id":"E0_INITIAL_VIGNETTE_DELIVERY","event_id":"P1V0-RUN-0020:P1V0-S-0026:E0_INITIAL_VIGNETTE_DELIVERY","event_kind":"STIMULUS_DELIVERY","payload_record":{"byte_length":511,"content_sha256":"a28e1ccf8dc2eaf39bededeb48cdc77da58e5e084040e4d7b5491588f0296ed2","encoding":"BASE64_OF_EXACT_UTF8_BYTES","normalization":"NONE","raw_payload_utf8_base64":"QXQgbmlnaHQgb24gYSBwdWJsaWMgcm91dGUsIGZvb3RzdGVwcyBhcmUgYXVkaWJsZSBiZWhpbmQgdGhlIHdhbGtlcjsgdGhlaXIgc291cmNlIGlzIG5vdCB2aXNpYmxlLgoKQ29udGV4dDoKLSBJbW1lZGlhdGVseSBiZWZvcmUgaGVhcmluZyB0aGUgZm9vdHN0ZXBzLCB0aGUgd2Fsa2VyIHJlcG9ydHMgbG93IGJvZGlseSBhcm91c2FsLgotIFdpdGhpbiB0aGUgcHJpb3Igd2VlaywgYSBzZXBhcmF0ZSBwZXJzb24gZm9sbG93ZWQgdGhlIHdhbGtlciBhY3Jvc3MgbXVsdGlwbGUgdHVybnMgYW5kIHRoZSBpbmNpZGVudCB3YXMgaW5kZXBlbmRlbnRseSByZXNvbHZlZCBhcyBmb2xsb3dpbmcuCi0gQWNyb3NzIHRoZSBmaXhlZCBvYnNlcnZhdGlvbiB3aW5kb3csIHRoZSBzYW1lIG51bWJlciwgdGltaW5nLCBkdXJhdGlvbiwgYW5kIGxvdWRuZXNzIG9mIGZvb3RzdGVwcyBpcyBoZWFyZCwgYnV0IHRoZSBzb3VyY2UgZG9lcyBub3QgcmVtYWluIGJlaGluZCBhZnRlciB0aGUgd2Fsa2VyJ3MgdHdvIHR1cm5zLg==","status":"PRESENT"},"sequence_ordinal":0},{"authority":"SCRIPTED_DELIVERY_RECORD_NOT_ACTUAL_OCCURRENCE_OR_ORDINAL_OBSERVATION","elicitation_step_id":"E1_GENERIC_IMMEDIATE_RESPONSE_PROMPT_DELIVERY","event_id":"P1V0-RUN-0020:P1V0-S-0026:E1_GENERIC_IMMEDIATE_RESPONSE_PROMPT_DELIVERY","event_kind":"PROMPT_DELIVERY","payload_record":{"byte_length":107,"content_sha256":"98ac7591e5d8c5db1dc3c68a521f6afb097a175d38961579603be9e6501f7ef0","encoding":"BASE64_OF_EXACT_UTF8_BYTES","normalization":"NONE","raw_payload_utf8_base64":"V2hhdCBpcyB0aGUgZmlyc3QgdGhpbmcgdGhlIHBlcnNvbiB3b3VsZCBzYXkgb3IgZG8gbmV4dD8gUmVzcG9uZCBmcmVlbHk7IHRoZXJlIGlzIG5vIHNpbmdsZSBjb3JyZWN0IGFuc3dlci4=","status":"PRESENT"},"sequence_ordinal":1},{"authority":"SCRIPTED_RESPONSE_RECORD_AND_PAYLOAD_PROVENANCE_ONLY","elicitation_step_id":"R1_IMMEDIATE_RESPONSE_EVENT","event_id":"P1V0-RUN-0020:P1V0-S-0026:R1_IMMEDIATE_RESPONSE_EVENT","event_kind":"SCRIPTED_RESPONSE_RECORD","payload_record":{"byte_length":5,"content_sha256":"f2a2db3fa63a4beafbee71cd17d1bc05c2f86e48aee2ae0dee60719de5ed8bf8","encoding":"BASE64_OF_EXACT_UTF8_BYTES","normalization":"NONE","raw_payload_utf8_base64":"ICAJICA=","status":"PRESENT"},"prompt_delivery_event_id":"P1V0-RUN-0020:P1V0-S-0026:E1_GENERIC_IMMEDIATE_RESPONSE_PROMPT_DELIVERY","response_status":"RESPONDED","sequence_ordinal":2},{"authority":"SCRIPTED_DELIVERY_RECORD_NOT_ACTUAL_OCCURRENCE_OR_ORDINAL_OBSERVATION","elicitation_step_id":"E2_MATCHED_FUTURE_OPTION_DELIVERY","event_id":"P1V0-RUN-0020:P1V0-S-0026:E2_MATCHED_FUTURE_OPTION_DELIVERY","event_kind":"STIMULUS_DELIVERY","payload_record":{"byte_length":71,"content_sha256":"9415bc1dea8950240d4c7efc116fb24658c4a82276df8025cfb49fc80519ffaa","encoding":"BASE64_OF_EXACT_UTF8_BYTES","normalization":"NONE","raw_payload_utf8_base64":"VGhlIHNvdXJjZSByZW1haW5zIGJlaGluZCBhbmQgbWF0Y2hlcyBhbm90aGVyIHR1cm4gdGFrZW4gYnkgdGhlIHdhbGtlci4=","status":"PRESENT"},"sequence_ordinal":3},{"authority":"SCRIPTED_DELIVERY_RECORD_NOT_ACTUAL_OCCURRENCE_OR_ORDINAL_OBSERVATION","elicitation_step_id":"E3_GENERIC_LATER_RESPONSE_PROMPT_DELIVERY","event_id":"P1V0-RUN-0020:P1V0-S-0026:E3_GENERIC_LATER_RESPONSE_PROMPT_DELIVERY","event_kind":"PROMPT_DELIVERY","payload_record":{"byte_length":130,"content_sha256":"aa183e93b71383358997a7dafdcc6001c9ef6f4191c8c3681a691c947a2935e5","encoding":"BASE64_OF_EXACT_UTF8_BYTES","normalization":"NONE","raw_payload_utf8_base64":"QWZ0ZXIgdGhpcyBhZGRpdGlvbmFsIGV2ZW50LCB3aGF0IGlzIHRoZSBuZXh0IHRoaW5nIHRoZSBwZXJzb24gd291bGQgc2F5IG9yIGRvPyBSZXNwb25kIGZyZWVseTsgdGhlcmUgaXMgbm8gc2luZ2xlIGNvcnJlY3QgYW5zd2VyLg==","status":"PRESENT"},"sequence_ordinal":4},{"authority":"SCRIPTED_RESPONSE_RECORD_AND_PAYLOAD_PROVENANCE_ONLY","elicitation_step_id":"R2_LATER_RESPONSE_EVENT","event_id":"P1V0-RUN-0020:P1V0-S-0026:R2_LATER_RESPONSE_EVENT","event_kind":"SCRIPTED_RESPONSE_RECORD","payload_record":{"byte_length":150,"content_sha256":"dbdeebffe3487552c426145a06a57a046b2ca41404bb58e11233b4e333968199","encoding":"BASE64_OF_EXACT_UTF8_BYTES","normalization":"NONE","raw_payload_utf8_base64":"6re4IOyCrOuejOydgCDslYTrp4ggIuyVjOqyoOyWtCwg64K07J28IOydtOyVvOq4sO2VmOyekCLrnbzqs6Ag7Ken6rKMIOuLte2VoCDqsoMg6rCZ64ukLiDri6Trp4wg7Y+J7IaM67O064ukIOuLteyepeydtCDsobDquIgg64qm7Ja07KeIIOyImOuKlCDsnojri6Qu","status":"PRESENT"},"prompt_delivery_event_id":"P1V0-RUN-0020:P1V0-S-0026:E3_GENERIC_LATER_RESPONSE_PROMPT_DELIVERY","response_status":"RESPONDED","sequence_ordinal":5}],"future_option_id":"FUTURE-RISK-1","presentation_id":"PRES-RISK-010-EN-V0","response_provenance_links":[{"authority":"LINKS_SCRIPTED_RESPONSE_RECORD_TO_SCRIPTED_DELIVERY_CONTEXT_ONLY","context_delivery_event_ids":["P1V0-RUN-0020:P1V0-S-0026:E0_INITIAL_VIGNETTE_DELIVERY"],"context_payload_sha256":["a28e1ccf8dc2eaf39bededeb48cdc77da58e5e084040e4d7b5491588f0296ed2"],"delivered_prompt_sha256":"98ac7591e5d8c5db1dc3c68a521f6afb097a175d38961579603be9e6501f7ef0","link_id":"P1V0-RUN-0020:P1V0-S-0026:link:R1_IMMEDIATE_RESPONSE_EVENT","prompt_delivery_event_id":"P1V0-RUN-0020:P1V0-S-0026:E1_GENERIC_IMMEDIATE_RESPONSE_PROMPT_DELIVERY","response_event_id":"P1V0-RUN-0020:P1V0-S-0026:R1_IMMEDIATE_RESPONSE_EVENT"},{"authority":"LINKS_SCRIPTED_RESPONSE_RECORD_TO_SCRIPTED_DELIVERY_CONTEXT_ONLY","context_delivery_event_ids":["P1V0-RUN-0020:P1V0-S-0026:E0_INITIAL_VIGNETTE_DELIVERY","P1V0-RUN-0020:P1V0-S-0026:E2_MATCHED_FUTURE_OPTION_DELIVERY"],"context_payload_sha256":["a28e1ccf8dc2eaf39bededeb48cdc77da58e5e084040e4d7b5491588f0296ed2","9415bc1dea8950240d4c7efc116fb24658c4a82276df8025cfb49fc80519ffaa"],"delivered_prompt_sha256":"aa183e93b71383358997a7dafdcc6001c9ef6f4191c8c3681a691c947a2935e5","link_id":"P1V0-RUN-0020:P1V0-S-0026:link:R2_LATER_RESPONSE_EVENT","prompt_delivery_event_id":"P1V0-RUN-0020:P1V0-S-0026:E3_GENERIC_LATER_RESPONSE_PROMPT_DELIVERY","response_event_id":"P1V0-RUN-0020:P1V0-S-0026:R2_LATER_RESPONSE_EVENT"}],"session_id":"P1V0-S-0026","source_cell_id":"risk-010"}],"source_kind":"SCRIPTED_ADVERSARIAL_RESPONSE","status":"IMMUTABLE_SCRIPTED_REPLAY_NO_ACTUAL_OCCURRENCE_OR_MECHANISM_RESULT"}