{"$schema":"./run.schema.json","artifact_type":"DEVELOPMENT_ELICITATION_SCRIPTED_REPLAY","authority":{"artifact_role":"DEVELOPMENT_ELICITATION_SCRIPTED_REPLAY_ARTIFACT","defect_status":"NO_DEFECT_CLASSIFICATION_EMITTED","empirical_status":"NO_ACTUAL_PARTICIPANT_OCCURRENCE_OR_HUMAN_MECHANISM_SUPPORT","mapping_status":"NO_MAPPING_EMITTED","response_authority":"SCRIPTED_RESPONSE_RECORD_AND_PAYLOAD_PROVENANCE_ONLY"},"instrument_binding":{"content_sha256":"52705bc686a69d43360eb0544eda59571c77dc1e29520ec4b156bcd60f413776","instrument_id":"INTERP-DIALOGUE-001P0-ELICITATION-INSTRUMENT-V0","instrument_version":"0.0.0"},"run_id":"P1V0-RUN-0012","schema_version":"1.0.0","session_input_sha256":"f90c3f5863f2f9d3575c8982e4d910dcaa0c4d3f843f07bc547cee1a7a37dbd7","sessions":[{"comparison_binding":{"status":"NOT_APPLICABLE"},"event_log":[{"authority":"SCRIPTED_DELIVERY_RECORD_NOT_ACTUAL_OCCURRENCE_OR_ORDINAL_OBSERVATION","elicitation_step_id":"E0_INITIAL_VIGNETTE_DELIVERY","event_id":"P1V0-RUN-0012:P1V0-S-0018:E0_INITIAL_VIGNETTE_DELIVERY","event_kind":"STIMULUS_DELIVERY","payload_record":{"byte_length":365,"content_sha256":"d95bc40006a2d5122139c650920abbf5baff6d15d62376931151f0d7a108f54b","encoding":"BASE64_OF_EXACT_UTF8_BYTES","normalization":"NONE","raw_payload_utf8_base64":"VGhlIHNwZWFrZXIgc2F5czogSSB3YW50IHRvIGJlIGFsb25lIGZvciBhIHdoaWxlIHRvZGF5LiBJIHdpbGwgY29udGFjdCB5b3UgdG9tb3Jyb3cuCgpDb250ZXh0OgotIFRoZSByZWNpcGllbnQgcmVwb3J0cyBhIGxvdyBjdXJyZW50IG1vb2QuCi0gQWNyb3NzIGNvbXBhcmFibGUgcHJpb3IgYm91bmRhcnkgcmVxdWVzdHMsIHRoaXMgcGFydG5lciByZXBlYXRlZGx5IHByb21pc2VkIGxhdGVyIGNvbnRhY3QgYW5kIHRoZW4gcmVtYWluZWQgdW5hdmFpbGFibGUgd2l0aG91dCBleHBsYW5hdGlvbi4KLSBUaGUgdmlnbmV0dGUgcmUtcHJlc2VudHMgYSBwcmlvciBvY2Nhc2lvbiBvZiB1bmV4cGxhaW5lZCBkaXN0YW5jZSBieSB0aGUgcGFydG5lci4=","status":"PRESENT"},"sequence_ordinal":0},{"authority":"SCRIPTED_DELIVERY_RECORD_NOT_ACTUAL_OCCURRENCE_OR_ORDINAL_OBSERVATION","elicitation_step_id":"E1_GENERIC_IMMEDIATE_RESPONSE_PROMPT_DELIVERY","event_id":"P1V0-RUN-0012:P1V0-S-0018:E1_GENERIC_IMMEDIATE_RESPONSE_PROMPT_DELIVERY","event_kind":"PROMPT_DELIVERY","payload_record":{"byte_length":107,"content_sha256":"98ac7591e5d8c5db1dc3c68a521f6afb097a175d38961579603be9e6501f7ef0","encoding":"BASE64_OF_EXACT_UTF8_BYTES","normalization":"NONE","raw_payload_utf8_base64":"V2hhdCBpcyB0aGUgZmlyc3QgdGhpbmcgdGhlIHBlcnNvbiB3b3VsZCBzYXkgb3IgZG8gbmV4dD8gUmVzcG9uZCBmcmVlbHk7IHRoZXJlIGlzIG5vIHNpbmdsZSBjb3JyZWN0IGFuc3dlci4=","status":"PRESENT"},"sequence_ordinal":1},{"authority":"SCRIPTED_RESPONSE_RECORD_AND_PAYLOAD_PROVENANCE_ONLY","elicitation_step_id":"R1_IMMEDIATE_RESPONSE_EVENT","event_id":"P1V0-RUN-0012:P1V0-S-0018:R1_IMMEDIATE_RESPONSE_EVENT","event_kind":"SCRIPTED_RESPONSE_RECORD","payload_record":{"byte_length":73,"content_sha256":"9a972d07737fdbbf5b1df4a3cea0af6ebcbba362928f37a8c8555d2d57867551","encoding":"BASE64_OF_EXACT_UTF8_BYTES","normalization":"NONE","raw_payload_utf8_base64":"VGhleSB3b3VsZCByZXBseSBicmllZmx5OiAiT2theS4gVG9tb3Jyb3cgd29ya3MuIFRha2UgdGhlIHRpbWUgeW91IG5lZWQuIg==","status":"PRESENT"},"prompt_delivery_event_id":"P1V0-RUN-0012:P1V0-S-0018:E1_GENERIC_IMMEDIATE_RESPONSE_PROMPT_DELIVERY","response_status":"RESPONDED","sequence_ordinal":2},{"authority":"SCRIPTED_DELIVERY_RECORD_NOT_ACTUAL_OCCURRENCE_OR_ORDINAL_OBSERVATION","elicitation_step_id":"E2_MATCHED_FUTURE_OPTION_DELIVERY","event_id":"P1V0-RUN-0012:P1V0-S-0018:E2_MATCHED_FUTURE_OPTION_DELIVERY","event_kind":"STIMULUS_DELIVERY","payload_record":{"byte_length":207,"content_sha256":"5b282aac27a846dcae91459ab12a49f3a2b87aabd252834a92e23cf7588e6d9d","encoding":"BASE64_OF_EXACT_UTF8_BYTES","normalization":"NONE","raw_payload_utf8_base64":"QXQgYSBuZXcgYWNjZXNzLCB0aGUgc2FtZSBwcmlvci1tYXRlcmlhbCBjdWUgdXNlZCBpbiB0aGUgaW5pdGlhbCBjZWxsIGlzIHJlLXByZXNlbnRlZCB3aGlsZSB0aGUgcmVjaXBpZW50IHJlcG9ydHMgYSBsb3cgY3VycmVudCBtb29kOyBubyBuZXcgcGFydG5lciB1dHRlcmFuY2UsIGJlaGF2aW9yLCBvciBleHRlcm5hbCB0YXJnZXQgZXZpZGVuY2UgaXMgYWRkZWQu","status":"PRESENT"},"sequence_ordinal":3},{"authority":"SCRIPTED_DELIVERY_RECORD_NOT_ACTUAL_OCCURRENCE_OR_ORDINAL_OBSERVATION","elicitation_step_id":"E3_GENERIC_LATER_RESPONSE_PROMPT_DELIVERY","event_id":"P1V0-RUN-0012:P1V0-S-0018:E3_GENERIC_LATER_RESPONSE_PROMPT_DELIVERY","event_kind":"PROMPT_DELIVERY","payload_record":{"byte_length":130,"content_sha256":"aa183e93b71383358997a7dafdcc6001c9ef6f4191c8c3681a691c947a2935e5","encoding":"BASE64_OF_EXACT_UTF8_BYTES","normalization":"NONE","raw_payload_utf8_base64":"QWZ0ZXIgdGhpcyBhZGRpdGlvbmFsIGV2ZW50LCB3aGF0IGlzIHRoZSBuZXh0IHRoaW5nIHRoZSBwZXJzb24gd291bGQgc2F5IG9yIGRvPyBSZXNwb25kIGZyZWVseTsgdGhlcmUgaXMgbm8gc2luZ2xlIGNvcnJlY3QgYW5zd2VyLg==","status":"PRESENT"},"sequence_ordinal":4},{"authority":"SCRIPTED_RESPONSE_RECORD_AND_PAYLOAD_PROVENANCE_ONLY","elicitation_step_id":"R2_LATER_RESPONSE_EVENT","event_id":"P1V0-RUN-0012:P1V0-S-0018:R2_LATER_RESPONSE_EVENT","event_kind":"SCRIPTED_RESPONSE_RECORD","payload_record":{"byte_length":5,"content_sha256":"f2a2db3fa63a4beafbee71cd17d1bc05c2f86e48aee2ae0dee60719de5ed8bf8","encoding":"BASE64_OF_EXACT_UTF8_BYTES","normalization":"NONE","raw_payload_utf8_base64":"ICAJICA=","status":"PRESENT"},"prompt_delivery_event_id":"P1V0-RUN-0012:P1V0-S-0018:E3_GENERIC_LATER_RESPONSE_PROMPT_DELIVERY","response_status":"RESPONDED","sequence_ordinal":5},{"authority":"SCRIPTED_DELIVERY_RECORD_NOT_ACTUAL_OCCURRENCE_OR_ORDINAL_OBSERVATION","elicitation_step_id":"D0_POST_TRACE_DIAGNOSTIC_PROMPT_DELIVERY","event_id":"P1V0-RUN-0012:P1V0-S-0018:D0_POST_TRACE_DIAGNOSTIC_PROMPT_DELIVERY","event_kind":"PROMPT_DELIVERY","payload_record":{"byte_length":100,"content_sha256":"26983c700c89ced0b2e017e050f4ef978b465d23144d06c596461fe4f260cf77","encoding":"BASE64_OF_EXACT_UTF8_BYTES","normalization":"NONE","raw_payload_utf8_base64":"QWZ0ZXIgY29tcGxldGluZyBib3RoIHJlc3BvbnNlcywgYnJpZWZseSBub3RlIHdoaWNoIGRldGFpbHMgb2YgdGhlIHNjZW5hcmlvIGluZmx1ZW5jZWQgeW91ciBhbnN3ZXJzLg==","status":"PRESENT"},"sequence_ordinal":6},{"authority":"SCRIPTED_RESPONSE_RECORD_AND_PAYLOAD_PROVENANCE_ONLY","elicitation_step_id":"RD0_RETROSPECTIVE_DIAGNOSTIC_RESPONSE_EVENT","event_id":"P1V0-RUN-0012:P1V0-S-0018:RD0_RETROSPECTIVE_DIAGNOSTIC_RESPONSE_EVENT","event_kind":"SCRIPTED_RESPONSE_RECORD","payload_record":{"byte_length":146,"content_sha256":"b04da1d98f08cc1816a0bc288653f90bfaa20a3df83b8bc5bbe696f8d80c6caa","encoding":"BASE64_OF_EXACT_UTF8_BYTES","normalization":"NONE","raw_payload_utf8_base64":"VGhlIG1vb2QgbGluZSBhbmQgdGhlIGhpc3RvcnkgbGluZSBpbmZsdWVuY2VkIG15IGFuc3dlcnMgbW9zdDsgdGhlIHRoaXJkIGNvbnRleHQgbGluZSBtb3N0bHkgcmVwZWF0ZWQgbWF0ZXJpYWwgdGhhdCB3YXMgYWxyZWFkeSBkZWxpdmVyZWQgZWFybGllci4=","status":"PRESENT"},"prompt_delivery_event_id":"P1V0-RUN-0012:P1V0-S-0018:D0_POST_TRACE_DIAGNOSTIC_PROMPT_DELIVERY","response_status":"RESPONDED","sequence_ordinal":7}],"future_option_id":"FUTURE-REL-1","presentation_id":"PRES-REL-111-EN-V0","response_provenance_links":[{"authority":"LINKS_SCRIPTED_RESPONSE_RECORD_TO_SCRIPTED_DELIVERY_CONTEXT_ONLY","context_delivery_event_ids":["P1V0-RUN-0012:P1V0-S-0018:E0_INITIAL_VIGNETTE_DELIVERY"],"context_payload_sha256":["d95bc40006a2d5122139c650920abbf5baff6d15d62376931151f0d7a108f54b"],"delivered_prompt_sha256":"98ac7591e5d8c5db1dc3c68a521f6afb097a175d38961579603be9e6501f7ef0","link_id":"P1V0-RUN-0012:P1V0-S-0018:link:R1_IMMEDIATE_RESPONSE_EVENT","prompt_delivery_event_id":"P1V0-RUN-0012:P1V0-S-0018:E1_GENERIC_IMMEDIATE_RESPONSE_PROMPT_DELIVERY","response_event_id":"P1V0-RUN-0012:P1V0-S-0018:R1_IMMEDIATE_RESPONSE_EVENT"},{"authority":"LINKS_SCRIPTED_RESPONSE_RECORD_TO_SCRIPTED_DELIVERY_CONTEXT_ONLY","context_delivery_event_ids":["P1V0-RUN-0012:P1V0-S-0018:E0_INITIAL_VIGNETTE_DELIVERY","P1V0-RUN-0012:P1V0-S-0018:E2_MATCHED_FUTURE_OPTION_DELIVERY"],"context_payload_sha256":["d95bc40006a2d5122139c650920abbf5baff6d15d62376931151f0d7a108f54b","5b282aac27a846dcae91459ab12a49f3a2b87aabd252834a92e23cf7588e6d9d"],"delivered_prompt_sha256":"aa183e93b71383358997a7dafdcc6001c9ef6f4191c8c3681a691c947a2935e5","link_id":"P1V0-RUN-0012:P1V0-S-0018:link:R2_LATER_RESPONSE_EVENT","prompt_delivery_event_id":"P1V0-RUN-0012:P1V0-S-0018:E3_GENERIC_LATER_RESPONSE_PROMPT_DELIVERY","response_event_id":"P1V0-RUN-0012:P1V0-S-0018:R2_LATER_RESPONSE_EVENT"},{"authority":"LINKS_SCRIPTED_RESPONSE_RECORD_TO_SCRIPTED_DELIVERY_CONTEXT_ONLY","context_delivery_event_ids":["P1V0-RUN-0012:P1V0-S-0018:E0_INITIAL_VIGNETTE_DELIVERY","P1V0-RUN-0012:P1V0-S-0018:E2_MATCHED_FUTURE_OPTION_DELIVERY"],"context_payload_sha256":["d95bc40006a2d5122139c650920abbf5baff6d15d62376931151f0d7a108f54b","5b282aac27a846dcae91459ab12a49f3a2b87aabd252834a92e23cf7588e6d9d"],"delivered_prompt_sha256":"26983c700c89ced0b2e017e050f4ef978b465d23144d06c596461fe4f260cf77","link_id":"P1V0-RUN-0012:P1V0-S-0018:link:RD0_RETROSPECTIVE_DIAGNOSTIC_RESPONSE_EVENT","prompt_delivery_event_id":"P1V0-RUN-0012:P1V0-S-0018:D0_POST_TRACE_DIAGNOSTIC_PROMPT_DELIVERY","response_event_id":"P1V0-RUN-0012:P1V0-S-0018:RD0_RETROSPECTIVE_DIAGNOSTIC_RESPONSE_EVENT"}],"session_id":"P1V0-S-0018","source_cell_id":"rel-111"}],"source_kind":"SCRIPTED_ADVERSARIAL_RESPONSE","status":"IMMUTABLE_SCRIPTED_REPLAY_NO_ACTUAL_OCCURRENCE_OR_MECHANISM_RESULT"}