{"$schema":"./run.schema.json","artifact_type":"DEVELOPMENT_ELICITATION_SCRIPTED_REPLAY","authority":{"artifact_role":"DEVELOPMENT_ELICITATION_SCRIPTED_REPLAY_ARTIFACT","defect_status":"NO_DEFECT_CLASSIFICATION_EMITTED","empirical_status":"NO_ACTUAL_PARTICIPANT_OCCURRENCE_OR_HUMAN_MECHANISM_SUPPORT","mapping_status":"NO_MAPPING_EMITTED","response_authority":"SCRIPTED_RESPONSE_RECORD_AND_PAYLOAD_PROVENANCE_ONLY"},"instrument_binding":{"content_sha256":"52705bc686a69d43360eb0544eda59571c77dc1e29520ec4b156bcd60f413776","instrument_id":"INTERP-DIALOGUE-001P0-ELICITATION-INSTRUMENT-V0","instrument_version":"0.0.0"},"run_id":"P1V0-RUN-0011","schema_version":"1.0.0","session_input_sha256":"f656cb9c6aeb7611107e014795fee4340ab83d912b3759c2854209fe522530b5","sessions":[{"comparison_binding":{"status":"NOT_APPLICABLE"},"event_log":[{"authority":"SCRIPTED_DELIVERY_RECORD_NOT_ACTUAL_OCCURRENCE_OR_ORDINAL_OBSERVATION","elicitation_step_id":"E0_INITIAL_VIGNETTE_DELIVERY","event_id":"P1V0-RUN-0011:P1V0-S-0017:E0_INITIAL_VIGNETTE_DELIVERY","event_kind":"STIMULUS_DELIVERY","payload_record":{"byte_length":384,"content_sha256":"5155c502fb49cea540380d5724157693b89a077d828b5cd5d6a39794ececaa20","encoding":"BASE64_OF_EXACT_UTF8_BYTES","normalization":"NONE","raw_payload_utf8_base64":"VGhlIHNwZWFrZXIgc2F5czogSSB3YW50IHRvIGJlIGFsb25lIGZvciBhIHdoaWxlIHRvZGF5LiBJIHdpbGwgY29udGFjdCB5b3UgdG9tb3Jyb3cuCgpDb250ZXh0OgotIFRoZSByZWNpcGllbnQgcmVwb3J0cyBhIGxvdyBjdXJyZW50IG1vb2QuCi0gQWNyb3NzIGNvbXBhcmFibGUgcHJpb3IgYm91bmRhcnkgcmVxdWVzdHMsIHRoaXMgcGFydG5lciByZXBlYXRlZGx5IHByb21pc2VkIGxhdGVyIGNvbnRhY3QgYW5kIHRoZW4gcmVtYWluZWQgdW5hdmFpbGFibGUgd2l0aG91dCBleHBsYW5hdGlvbi4KLSBUaGUgdmlnbmV0dGUgcmUtcHJlc2VudHMgYSBwcmlvciBzbWFsbCBhY3QgaW4gd2hpY2ggdGhlIHBhcnRuZXIgbm90aWNlZCBhIG5lZWQgYW5kIGZvbGxvd2VkIHRocm91Z2gu","status":"PRESENT"},"sequence_ordinal":0},{"authority":"SCRIPTED_DELIVERY_RECORD_NOT_ACTUAL_OCCURRENCE_OR_ORDINAL_OBSERVATION","elicitation_step_id":"E1_GENERIC_IMMEDIATE_RESPONSE_PROMPT_DELIVERY","event_id":"P1V0-RUN-0011:P1V0-S-0017:E1_GENERIC_IMMEDIATE_RESPONSE_PROMPT_DELIVERY","event_kind":"PROMPT_DELIVERY","payload_record":{"byte_length":107,"content_sha256":"98ac7591e5d8c5db1dc3c68a521f6afb097a175d38961579603be9e6501f7ef0","encoding":"BASE64_OF_EXACT_UTF8_BYTES","normalization":"NONE","raw_payload_utf8_base64":"V2hhdCBpcyB0aGUgZmlyc3QgdGhpbmcgdGhlIHBlcnNvbiB3b3VsZCBzYXkgb3IgZG8gbmV4dD8gUmVzcG9uZCBmcmVlbHk7IHRoZXJlIGlzIG5vIHNpbmdsZSBjb3JyZWN0IGFuc3dlci4=","status":"PRESENT"},"sequence_ordinal":1},{"authority":"SCRIPTED_RESPONSE_RECORD_AND_PAYLOAD_PROVENANCE_ONLY","elicitation_step_id":"R1_IMMEDIATE_RESPONSE_EVENT","event_id":"P1V0-RUN-0011:P1V0-S-0017:R1_IMMEDIATE_RESPONSE_EVENT","event_kind":"SCRIPTED_RESPONSE_RECORD","payload_record":{"reason":"TECHNICAL_FAILURE","status":"ABSENT"},"prompt_delivery_event_id":"P1V0-RUN-0011:P1V0-S-0017:E1_GENERIC_IMMEDIATE_RESPONSE_PROMPT_DELIVERY","response_status":"TECHNICAL_FAILURE","sequence_ordinal":2},{"authority":"SCRIPTED_DELIVERY_RECORD_NOT_ACTUAL_OCCURRENCE_OR_ORDINAL_OBSERVATION","elicitation_step_id":"E2_MATCHED_FUTURE_OPTION_DELIVERY","event_id":"P1V0-RUN-0011:P1V0-S-0017:E2_MATCHED_FUTURE_OPTION_DELIVERY","event_kind":"STIMULUS_DELIVERY","payload_record":{"byte_length":213,"content_sha256":"27a2df34e776711e75d4c335e8e493f8365176cccd1f87ffaa1568fc907f1b72","encoding":"BASE64_OF_EXACT_UTF8_BYTES","normalization":"NONE","raw_payload_utf8_base64":"QXQgYSBuZXcgYWNjZXNzLCB0aGUgc2FtZSBwcmlvci1tYXRlcmlhbCBjdWUgdXNlZCBpbiB0aGUgaW5pdGlhbCBjZWxsIGlzIHJlLXByZXNlbnRlZCB3aGlsZSB0aGUgcmVjaXBpZW50IHJlcG9ydHMgYW4gb3JkaW5hcnkgY3VycmVudCBtb29kOyBubyBuZXcgcGFydG5lciB1dHRlcmFuY2UsIGJlaGF2aW9yLCBvciBleHRlcm5hbCB0YXJnZXQgZXZpZGVuY2UgaXMgYWRkZWQu","status":"PRESENT"},"sequence_ordinal":3},{"authority":"SCRIPTED_DELIVERY_RECORD_NOT_ACTUAL_OCCURRENCE_OR_ORDINAL_OBSERVATION","elicitation_step_id":"E3_GENERIC_LATER_RESPONSE_PROMPT_DELIVERY","event_id":"P1V0-RUN-0011:P1V0-S-0017:E3_GENERIC_LATER_RESPONSE_PROMPT_DELIVERY","event_kind":"PROMPT_DELIVERY","payload_record":{"byte_length":130,"content_sha256":"aa183e93b71383358997a7dafdcc6001c9ef6f4191c8c3681a691c947a2935e5","encoding":"BASE64_OF_EXACT_UTF8_BYTES","normalization":"NONE","raw_payload_utf8_base64":"QWZ0ZXIgdGhpcyBhZGRpdGlvbmFsIGV2ZW50LCB3aGF0IGlzIHRoZSBuZXh0IHRoaW5nIHRoZSBwZXJzb24gd291bGQgc2F5IG9yIGRvPyBSZXNwb25kIGZyZWVseTsgdGhlcmUgaXMgbm8gc2luZ2xlIGNvcnJlY3QgYW5zd2VyLg==","status":"PRESENT"},"sequence_ordinal":4},{"authority":"SCRIPTED_RESPONSE_RECORD_AND_PAYLOAD_PROVENANCE_ONLY","elicitation_step_id":"R2_LATER_RESPONSE_EVENT","event_id":"P1V0-RUN-0011:P1V0-S-0017:R2_LATER_RESPONSE_EVENT","event_kind":"SCRIPTED_RESPONSE_RECORD","payload_record":{"byte_length":73,"content_sha256":"9a972d07737fdbbf5b1df4a3cea0af6ebcbba362928f37a8c8555d2d57867551","encoding":"BASE64_OF_EXACT_UTF8_BYTES","normalization":"NONE","raw_payload_utf8_base64":"VGhleSB3b3VsZCByZXBseSBicmllZmx5OiAiT2theS4gVG9tb3Jyb3cgd29ya3MuIFRha2UgdGhlIHRpbWUgeW91IG5lZWQuIg==","status":"PRESENT"},"prompt_delivery_event_id":"P1V0-RUN-0011:P1V0-S-0017:E3_GENERIC_LATER_RESPONSE_PROMPT_DELIVERY","response_status":"RESPONDED","sequence_ordinal":5}],"future_option_id":"FUTURE-REL-0","presentation_id":"PRES-REL-110-EN-V0","response_provenance_links":[{"authority":"LINKS_SCRIPTED_RESPONSE_RECORD_TO_SCRIPTED_DELIVERY_CONTEXT_ONLY","context_delivery_event_ids":["P1V0-RUN-0011:P1V0-S-0017:E0_INITIAL_VIGNETTE_DELIVERY"],"context_payload_sha256":["5155c502fb49cea540380d5724157693b89a077d828b5cd5d6a39794ececaa20"],"delivered_prompt_sha256":"98ac7591e5d8c5db1dc3c68a521f6afb097a175d38961579603be9e6501f7ef0","link_id":"P1V0-RUN-0011:P1V0-S-0017:link:R1_IMMEDIATE_RESPONSE_EVENT","prompt_delivery_event_id":"P1V0-RUN-0011:P1V0-S-0017:E1_GENERIC_IMMEDIATE_RESPONSE_PROMPT_DELIVERY","response_event_id":"P1V0-RUN-0011:P1V0-S-0017:R1_IMMEDIATE_RESPONSE_EVENT"},{"authority":"LINKS_SCRIPTED_RESPONSE_RECORD_TO_SCRIPTED_DELIVERY_CONTEXT_ONLY","context_delivery_event_ids":["P1V0-RUN-0011:P1V0-S-0017:E0_INITIAL_VIGNETTE_DELIVERY","P1V0-RUN-0011:P1V0-S-0017:E2_MATCHED_FUTURE_OPTION_DELIVERY"],"context_payload_sha256":["5155c502fb49cea540380d5724157693b89a077d828b5cd5d6a39794ececaa20","27a2df34e776711e75d4c335e8e493f8365176cccd1f87ffaa1568fc907f1b72"],"delivered_prompt_sha256":"aa183e93b71383358997a7dafdcc6001c9ef6f4191c8c3681a691c947a2935e5","link_id":"P1V0-RUN-0011:P1V0-S-0017:link:R2_LATER_RESPONSE_EVENT","prompt_delivery_event_id":"P1V0-RUN-0011:P1V0-S-0017:E3_GENERIC_LATER_RESPONSE_PROMPT_DELIVERY","response_event_id":"P1V0-RUN-0011:P1V0-S-0017:R2_LATER_RESPONSE_EVENT"}],"session_id":"P1V0-S-0017","source_cell_id":"rel-110"}],"source_kind":"SCRIPTED_ADVERSARIAL_RESPONSE","status":"IMMUTABLE_SCRIPTED_REPLAY_NO_ACTUAL_OCCURRENCE_OR_MECHANISM_RESULT"}