{"$schema":"./run.schema.json","artifact_type":"DEVELOPMENT_ELICITATION_SCRIPTED_REPLAY","authority":{"artifact_role":"DEVELOPMENT_ELICITATION_SCRIPTED_REPLAY_ARTIFACT","defect_status":"NO_DEFECT_CLASSIFICATION_EMITTED","empirical_status":"NO_ACTUAL_PARTICIPANT_OCCURRENCE_OR_HUMAN_MECHANISM_SUPPORT","mapping_status":"NO_MAPPING_EMITTED","response_authority":"SCRIPTED_RESPONSE_RECORD_AND_PAYLOAD_PROVENANCE_ONLY"},"instrument_binding":{"content_sha256":"52705bc686a69d43360eb0544eda59571c77dc1e29520ec4b156bcd60f413776","instrument_id":"INTERP-DIALOGUE-001P0-ELICITATION-INSTRUMENT-V0","instrument_version":"0.0.0"},"run_id":"P1V0-RUN-0013","schema_version":"1.0.0","session_input_sha256":"24c23e80469099d13dcfeca3a59dcac193e21bf17a128847ba8397f19c99ea87","sessions":[{"comparison_binding":{"status":"NOT_APPLICABLE"},"event_log":[{"authority":"SCRIPTED_DELIVERY_RECORD_NOT_ACTUAL_OCCURRENCE_OR_ORDINAL_OBSERVATION","elicitation_step_id":"E0_INITIAL_VIGNETTE_DELIVERY","event_id":"P1V0-RUN-0013:P1V0-S-0019:E0_INITIAL_VIGNETTE_DELIVERY","event_kind":"STIMULUS_DELIVERY","payload_record":{"byte_length":372,"content_sha256":"449b3e1f39c0604dd3d567c0ce34833e9697932eaba95b2cb380597ab902c1aa","encoding":"BASE64_OF_EXACT_UTF8_BYTES","normalization":"NONE","raw_payload_utf8_base64":"VGhlIGV2YWx1YXRvciBzYXlzOiBUaGUgZGlyZWN0aW9uIGlzIGdvb2QsIGJ1dCB0aGlzIHJlc3VsdCBkaWQgbm90IG1lZXQgZXhwZWN0YXRpb25zLgoKQ29udGV4dDoKLSBJbW1lZGlhdGVseSBiZWZvcmUgcmVjZWl2aW5nIHRoZSBmZWVkYmFjaywgdGhlIHJlY2lwaWVudCByZXBvcnRzIGxvdyBldmFsdWF0aW9uIHRocmVhdC4KLSBBY3Jvc3MgcHJpb3IgY29tcGFyYWJsZSBldmFsdWF0aW9ucywgdGhpcyBldmFsdWF0b3IgYXBwbGllZCB0aGUgc2FtZSBzdGF0ZWQgY3JpdGVyaWEgY29uc2lzdGVudGx5LgotIFRoZSBldmFsdWF0b3IgYWRkcyB0aHJlZSBkaXJlY3RseSBjaGVja2FibGUgcmV2aXNpb24gaXRlbXMgYWZ0ZXIgdGhlIGJhc2UgZmVlZGJhY2su","status":"PRESENT"},"sequence_ordinal":0},{"authority":"SCRIPTED_DELIVERY_RECORD_NOT_ACTUAL_OCCURRENCE_OR_ORDINAL_OBSERVATION","elicitation_step_id":"E1_GENERIC_IMMEDIATE_RESPONSE_PROMPT_DELIVERY","event_id":"P1V0-RUN-0013:P1V0-S-0019:E1_GENERIC_IMMEDIATE_RESPONSE_PROMPT_DELIVERY","event_kind":"PROMPT_DELIVERY","payload_record":{"byte_length":107,"content_sha256":"98ac7591e5d8c5db1dc3c68a521f6afb097a175d38961579603be9e6501f7ef0","encoding":"BASE64_OF_EXACT_UTF8_BYTES","normalization":"NONE","raw_payload_utf8_base64":"V2hhdCBpcyB0aGUgZmlyc3QgdGhpbmcgdGhlIHBlcnNvbiB3b3VsZCBzYXkgb3IgZG8gbmV4dD8gUmVzcG9uZCBmcmVlbHk7IHRoZXJlIGlzIG5vIHNpbmdsZSBjb3JyZWN0IGFuc3dlci4=","status":"PRESENT"},"sequence_ordinal":1},{"authority":"SCRIPTED_RESPONSE_RECORD_AND_PAYLOAD_PROVENANCE_ONLY","elicitation_step_id":"R1_IMMEDIATE_RESPONSE_EVENT","event_id":"P1V0-RUN-0013:P1V0-S-0019:R1_IMMEDIATE_RESPONSE_EVENT","event_kind":"SCRIPTED_RESPONSE_RECORD","payload_record":{"byte_length":53,"content_sha256":"b862a601277af0eedec38d6c1c38cd55505c99370329f1bd04c6c814e704aff1","encoding":"BASE64_OF_EXACT_UTF8_BYTES","normalization":"NONE","raw_payload_utf8_base64":"VGhleSB3b3VsZCBzYXk6ICJJIHVuZGVyc3RhbmQuIgpUaGVuIHRoZXkgd291bGQgd2FpdC4=","status":"PRESENT"},"prompt_delivery_event_id":"P1V0-RUN-0013:P1V0-S-0019:E1_GENERIC_IMMEDIATE_RESPONSE_PROMPT_DELIVERY","response_status":"RESPONDED","sequence_ordinal":2},{"authority":"SCRIPTED_DELIVERY_RECORD_NOT_ACTUAL_OCCURRENCE_OR_ORDINAL_OBSERVATION","elicitation_step_id":"E2_MATCHED_FUTURE_OPTION_DELIVERY","event_id":"P1V0-RUN-0013:P1V0-S-0019:E2_MATCHED_FUTURE_OPTION_DELIVERY","event_kind":"STIMULUS_DELIVERY","payload_record":{"byte_length":82,"content_sha256":"5604d2bd96617fa300e3bf6cebc4ace1f013a74295a1e9d07e063906163f179d","encoding":"BASE64_OF_EXACT_UTF8_BYTES","normalization":"NONE","raw_payload_utf8_base64":"QWZ0ZXIgcmV2aXNpb24sIHRoZSBldmFsdWF0b3IgcmVwZWF0cyBnbG9iYWwgZGlzc2F0aXNmYWN0aW9uIHdpdGhvdXQgbmV3IGNyaXRlcmlhLg==","status":"PRESENT"},"sequence_ordinal":3},{"authority":"SCRIPTED_DELIVERY_RECORD_NOT_ACTUAL_OCCURRENCE_OR_ORDINAL_OBSERVATION","elicitation_step_id":"E3_GENERIC_LATER_RESPONSE_PROMPT_DELIVERY","event_id":"P1V0-RUN-0013:P1V0-S-0019:E3_GENERIC_LATER_RESPONSE_PROMPT_DELIVERY","event_kind":"PROMPT_DELIVERY","payload_record":{"byte_length":130,"content_sha256":"aa183e93b71383358997a7dafdcc6001c9ef6f4191c8c3681a691c947a2935e5","encoding":"BASE64_OF_EXACT_UTF8_BYTES","normalization":"NONE","raw_payload_utf8_base64":"QWZ0ZXIgdGhpcyBhZGRpdGlvbmFsIGV2ZW50LCB3aGF0IGlzIHRoZSBuZXh0IHRoaW5nIHRoZSBwZXJzb24gd291bGQgc2F5IG9yIGRvPyBSZXNwb25kIGZyZWVseTsgdGhlcmUgaXMgbm8gc2luZ2xlIGNvcnJlY3QgYW5zd2VyLg==","status":"PRESENT"},"sequence_ordinal":4},{"authority":"SCRIPTED_RESPONSE_RECORD_AND_PAYLOAD_PROVENANCE_ONLY","elicitation_step_id":"R2_LATER_RESPONSE_EVENT","event_id":"P1V0-RUN-0013:P1V0-S-0019:R2_LATER_RESPONSE_EVENT","event_kind":"SCRIPTED_RESPONSE_RECORD","payload_record":{"byte_length":163,"content_sha256":"01cf2187016c84efe5d8daaf1c231770fc26e82ba6035e670d144b9eaa95dd44","encoding":"BASE64_OF_EXACT_UTF8_BYTES","normalization":"NONE","raw_payload_utf8_base64":"V2hpY2ggcGVyc29uIGRvIHlvdSBtZWFuPyBUaGUgb25lIHdobyBzcG9rZSwgb3IgdGhlIG9uZSB3aG8gcmVjZWl2ZWQgdGhlIG1lc3NhZ2U/IFRoZSBwcm9tcHQgc2F5cyAidGhlIHBlcnNvbiIgYW5kIEkgY2Fubm90IHRlbGwgd2hvc2UgbmV4dCBtb3ZlIEkgc2hvdWxkIGRlc2NyaWJlLg==","status":"PRESENT"},"prompt_delivery_event_id":"P1V0-RUN-0013:P1V0-S-0019:E3_GENERIC_LATER_RESPONSE_PROMPT_DELIVERY","response_status":"RESPONDED","sequence_ordinal":5}],"future_option_id":"FUTURE-WORK-1","presentation_id":"PRES-WORK-001-EN-V0","response_provenance_links":[{"authority":"LINKS_SCRIPTED_RESPONSE_RECORD_TO_SCRIPTED_DELIVERY_CONTEXT_ONLY","context_delivery_event_ids":["P1V0-RUN-0013:P1V0-S-0019:E0_INITIAL_VIGNETTE_DELIVERY"],"context_payload_sha256":["449b3e1f39c0604dd3d567c0ce34833e9697932eaba95b2cb380597ab902c1aa"],"delivered_prompt_sha256":"98ac7591e5d8c5db1dc3c68a521f6afb097a175d38961579603be9e6501f7ef0","link_id":"P1V0-RUN-0013:P1V0-S-0019:link:R1_IMMEDIATE_RESPONSE_EVENT","prompt_delivery_event_id":"P1V0-RUN-0013:P1V0-S-0019:E1_GENERIC_IMMEDIATE_RESPONSE_PROMPT_DELIVERY","response_event_id":"P1V0-RUN-0013:P1V0-S-0019:R1_IMMEDIATE_RESPONSE_EVENT"},{"authority":"LINKS_SCRIPTED_RESPONSE_RECORD_TO_SCRIPTED_DELIVERY_CONTEXT_ONLY","context_delivery_event_ids":["P1V0-RUN-0013:P1V0-S-0019:E0_INITIAL_VIGNETTE_DELIVERY","P1V0-RUN-0013:P1V0-S-0019:E2_MATCHED_FUTURE_OPTION_DELIVERY"],"context_payload_sha256":["449b3e1f39c0604dd3d567c0ce34833e9697932eaba95b2cb380597ab902c1aa","5604d2bd96617fa300e3bf6cebc4ace1f013a74295a1e9d07e063906163f179d"],"delivered_prompt_sha256":"aa183e93b71383358997a7dafdcc6001c9ef6f4191c8c3681a691c947a2935e5","link_id":"P1V0-RUN-0013:P1V0-S-0019:link:R2_LATER_RESPONSE_EVENT","prompt_delivery_event_id":"P1V0-RUN-0013:P1V0-S-0019:E3_GENERIC_LATER_RESPONSE_PROMPT_DELIVERY","response_event_id":"P1V0-RUN-0013:P1V0-S-0019:R2_LATER_RESPONSE_EVENT"}],"session_id":"P1V0-S-0019","source_cell_id":"work-001"}],"source_kind":"SCRIPTED_ADVERSARIAL_RESPONSE","status":"IMMUTABLE_SCRIPTED_REPLAY_NO_ACTUAL_OCCURRENCE_OR_MECHANISM_RESULT"}