{"$schema":"./run.schema.json","artifact_type":"DEVELOPMENT_ELICITATION_SCRIPTED_REPLAY","authority":{"artifact_role":"DEVELOPMENT_ELICITATION_SCRIPTED_REPLAY_ARTIFACT","defect_status":"NO_DEFECT_CLASSIFICATION_EMITTED","empirical_status":"NO_ACTUAL_PARTICIPANT_OCCURRENCE_OR_HUMAN_MECHANISM_SUPPORT","mapping_status":"NO_MAPPING_EMITTED","response_authority":"SCRIPTED_RESPONSE_RECORD_AND_PAYLOAD_PROVENANCE_ONLY"},"instrument_binding":{"content_sha256":"52705bc686a69d43360eb0544eda59571c77dc1e29520ec4b156bcd60f413776","instrument_id":"INTERP-DIALOGUE-001P0-ELICITATION-INSTRUMENT-V0","instrument_version":"0.0.0"},"run_id":"P1V0-RUN-0019","schema_version":"1.0.0","session_input_sha256":"cb35746128c13067bc67ea621c5ab4b7325e4bdb0ca73733684407a51504e7db","sessions":[{"comparison_binding":{"status":"NOT_APPLICABLE"},"event_log":[{"authority":"SCRIPTED_DELIVERY_RECORD_NOT_ACTUAL_OCCURRENCE_OR_ORDINAL_OBSERVATION","elicitation_step_id":"E0_INITIAL_VIGNETTE_DELIVERY","event_id":"P1V0-RUN-0019:P1V0-S-0025:E0_INITIAL_VIGNETTE_DELIVERY","event_kind":"STIMULUS_DELIVERY","payload_record":{"byte_length":476,"content_sha256":"a515a6eb0cae606850fe78cf0eeb96c78fa4da674799d9eca16c5f230b6de26c","encoding":"BASE64_OF_EXACT_UTF8_BYTES","normalization":"NONE","raw_payload_utf8_base64":"QXQgbmlnaHQgb24gYSBwdWJsaWMgcm91dGUsIGZvb3RzdGVwcyBhcmUgYXVkaWJsZSBiZWhpbmQgdGhlIHdhbGtlcjsgdGhlaXIgc291cmNlIGlzIG5vdCB2aXNpYmxlLgoKQ29udGV4dDoKLSBJbW1lZGlhdGVseSBiZWZvcmUgaGVhcmluZyB0aGUgZm9vdHN0ZXBzLCB0aGUgd2Fsa2VyIHJlcG9ydHMgbG93IGJvZGlseSBhcm91c2FsLgotIFdpdGhpbiB0aGUgc2FtZSBwcmlvci13ZWVrIHdpbmRvdywgdGhlIHZpZ25ldHRlIHN0YXRlcyB0aGF0IG5vIGluY2lkZW50IG9mIGJlaW5nIGZvbGxvd2VkIG9yIHRocmVhdGVuZWQgb2NjdXJyZWQuCi0gQWNyb3NzIHRoZSBmaXhlZCBvYnNlcnZhdGlvbiB3aW5kb3csIHRoZSBzYW1lIG51bWJlciwgdGltaW5nLCBkdXJhdGlvbiwgYW5kIGxvdWRuZXNzIG9mIGZvb3RzdGVwcyBpcyBoZWFyZCwgYW5kIHRoZSBzb3VyY2UgcmVtYWlucyBiZWhpbmQgYWZ0ZXIgdGhlIHdhbGtlcidzIHR3byB0dXJucy4=","status":"PRESENT"},"sequence_ordinal":0},{"authority":"SCRIPTED_DELIVERY_RECORD_NOT_ACTUAL_OCCURRENCE_OR_ORDINAL_OBSERVATION","elicitation_step_id":"E1_GENERIC_IMMEDIATE_RESPONSE_PROMPT_DELIVERY","event_id":"P1V0-RUN-0019:P1V0-S-0025:E1_GENERIC_IMMEDIATE_RESPONSE_PROMPT_DELIVERY","event_kind":"PROMPT_DELIVERY","payload_record":{"byte_length":107,"content_sha256":"98ac7591e5d8c5db1dc3c68a521f6afb097a175d38961579603be9e6501f7ef0","encoding":"BASE64_OF_EXACT_UTF8_BYTES","normalization":"NONE","raw_payload_utf8_base64":"V2hhdCBpcyB0aGUgZmlyc3QgdGhpbmcgdGhlIHBlcnNvbiB3b3VsZCBzYXkgb3IgZG8gbmV4dD8gUmVzcG9uZCBmcmVlbHk7IHRoZXJlIGlzIG5vIHNpbmdsZSBjb3JyZWN0IGFuc3dlci4=","status":"PRESENT"},"sequence_ordinal":1},{"authority":"SCRIPTED_RESPONSE_RECORD_AND_PAYLOAD_PROVENANCE_ONLY","elicitation_step_id":"R1_IMMEDIATE_RESPONSE_EVENT","event_id":"P1V0-RUN-0019:P1V0-S-0025:R1_IMMEDIATE_RESPONSE_EVENT","event_kind":"SCRIPTED_RESPONSE_RECORD","payload_record":{"byte_length":140,"content_sha256":"9a7d889009b587589defa5200c6d28d153411e4b398fc342fa81ae0041b08f13","encoding":"BASE64_OF_EXACT_UTF8_BYTES","normalization":"NONE","raw_payload_utf8_base64":"5b285aWz44Gv44Gf44G244KT44CM44KP44GL44Gj44Gf44CB44G+44Gf5piO5pel44Gt44CN44Go55+t44GP6L+U44GZ44CC8J+YjPCfkY0g44Gd44Gu44GC44GoIGNhZmXMgSDjga7jgZPjgajjga/lj6PjgavjgZfjgarjgYTjgajmgJ3jgYbjgII=","status":"PRESENT"},"prompt_delivery_event_id":"P1V0-RUN-0019:P1V0-S-0025:E1_GENERIC_IMMEDIATE_RESPONSE_PROMPT_DELIVERY","response_status":"RESPONDED","sequence_ordinal":2},{"authority":"SCRIPTED_DELIVERY_RECORD_NOT_ACTUAL_OCCURRENCE_OR_ORDINAL_OBSERVATION","elicitation_step_id":"E2_MATCHED_FUTURE_OPTION_DELIVERY","event_id":"P1V0-RUN-0019:P1V0-S-0025:E2_MATCHED_FUTURE_OPTION_DELIVERY","event_kind":"STIMULUS_DELIVERY","payload_record":{"byte_length":71,"content_sha256":"9415bc1dea8950240d4c7efc116fb24658c4a82276df8025cfb49fc80519ffaa","encoding":"BASE64_OF_EXACT_UTF8_BYTES","normalization":"NONE","raw_payload_utf8_base64":"VGhlIHNvdXJjZSByZW1haW5zIGJlaGluZCBhbmQgbWF0Y2hlcyBhbm90aGVyIHR1cm4gdGFrZW4gYnkgdGhlIHdhbGtlci4=","status":"PRESENT"},"sequence_ordinal":3},{"authority":"SCRIPTED_DELIVERY_RECORD_NOT_ACTUAL_OCCURRENCE_OR_ORDINAL_OBSERVATION","elicitation_step_id":"E3_GENERIC_LATER_RESPONSE_PROMPT_DELIVERY","event_id":"P1V0-RUN-0019:P1V0-S-0025:E3_GENERIC_LATER_RESPONSE_PROMPT_DELIVERY","event_kind":"PROMPT_DELIVERY","payload_record":{"byte_length":130,"content_sha256":"aa183e93b71383358997a7dafdcc6001c9ef6f4191c8c3681a691c947a2935e5","encoding":"BASE64_OF_EXACT_UTF8_BYTES","normalization":"NONE","raw_payload_utf8_base64":"QWZ0ZXIgdGhpcyBhZGRpdGlvbmFsIGV2ZW50LCB3aGF0IGlzIHRoZSBuZXh0IHRoaW5nIHRoZSBwZXJzb24gd291bGQgc2F5IG9yIGRvPyBSZXNwb25kIGZyZWVseTsgdGhlcmUgaXMgbm8gc2luZ2xlIGNvcnJlY3QgYW5zd2VyLg==","status":"PRESENT"},"sequence_ordinal":4},{"authority":"SCRIPTED_RESPONSE_RECORD_AND_PAYLOAD_PROVENANCE_ONLY","elicitation_step_id":"R2_LATER_RESPONSE_EVENT","event_id":"P1V0-RUN-0019:P1V0-S-0025:R2_LATER_RESPONSE_EVENT","event_kind":"SCRIPTED_RESPONSE_RECORD","payload_record":{"byte_length":0,"content_sha256":"e3b0c44298fc1c149afbf4c8996fb92427ae41e4649b934ca495991b7852b855","encoding":"BASE64_OF_EXACT_UTF8_BYTES","normalization":"NONE","raw_payload_utf8_base64":"","status":"PRESENT"},"prompt_delivery_event_id":"P1V0-RUN-0019:P1V0-S-0025:E3_GENERIC_LATER_RESPONSE_PROMPT_DELIVERY","response_status":"RESPONDED","sequence_ordinal":5},{"authority":"SCRIPTED_DELIVERY_RECORD_NOT_ACTUAL_OCCURRENCE_OR_ORDINAL_OBSERVATION","elicitation_step_id":"D0_POST_TRACE_DIAGNOSTIC_PROMPT_DELIVERY","event_id":"P1V0-RUN-0019:P1V0-S-0025:D0_POST_TRACE_DIAGNOSTIC_PROMPT_DELIVERY","event_kind":"PROMPT_DELIVERY","payload_record":{"byte_length":100,"content_sha256":"26983c700c89ced0b2e017e050f4ef978b465d23144d06c596461fe4f260cf77","encoding":"BASE64_OF_EXACT_UTF8_BYTES","normalization":"NONE","raw_payload_utf8_base64":"QWZ0ZXIgY29tcGxldGluZyBib3RoIHJlc3BvbnNlcywgYnJpZWZseSBub3RlIHdoaWNoIGRldGFpbHMgb2YgdGhlIHNjZW5hcmlvIGluZmx1ZW5jZWQgeW91ciBhbnN3ZXJzLg==","status":"PRESENT"},"sequence_ordinal":6},{"authority":"SCRIPTED_RESPONSE_RECORD_AND_PAYLOAD_PROVENANCE_ONLY","elicitation_step_id":"RD0_RETROSPECTIVE_DIAGNOSTIC_RESPONSE_EVENT","event_id":"P1V0-RUN-0019:P1V0-S-0025:RD0_RETROSPECTIVE_DIAGNOSTIC_RESPONSE_EVENT","event_kind":"SCRIPTED_RESPONSE_RECORD","payload_record":{"byte_length":146,"content_sha256":"b04da1d98f08cc1816a0bc288653f90bfaa20a3df83b8bc5bbe696f8d80c6caa","encoding":"BASE64_OF_EXACT_UTF8_BYTES","normalization":"NONE","raw_payload_utf8_base64":"VGhlIG1vb2QgbGluZSBhbmQgdGhlIGhpc3RvcnkgbGluZSBpbmZsdWVuY2VkIG15IGFuc3dlcnMgbW9zdDsgdGhlIHRoaXJkIGNvbnRleHQgbGluZSBtb3N0bHkgcmVwZWF0ZWQgbWF0ZXJpYWwgdGhhdCB3YXMgYWxyZWFkeSBkZWxpdmVyZWQgZWFybGllci4=","status":"PRESENT"},"prompt_delivery_event_id":"P1V0-RUN-0019:P1V0-S-0025:D0_POST_TRACE_DIAGNOSTIC_PROMPT_DELIVERY","response_status":"RESPONDED","sequence_ordinal":7}],"future_option_id":"FUTURE-RISK-1","presentation_id":"PRES-RISK-001-EN-V0","response_provenance_links":[{"authority":"LINKS_SCRIPTED_RESPONSE_RECORD_TO_SCRIPTED_DELIVERY_CONTEXT_ONLY","context_delivery_event_ids":["P1V0-RUN-0019:P1V0-S-0025:E0_INITIAL_VIGNETTE_DELIVERY"],"context_payload_sha256":["a515a6eb0cae606850fe78cf0eeb96c78fa4da674799d9eca16c5f230b6de26c"],"delivered_prompt_sha256":"98ac7591e5d8c5db1dc3c68a521f6afb097a175d38961579603be9e6501f7ef0","link_id":"P1V0-RUN-0019:P1V0-S-0025:link:R1_IMMEDIATE_RESPONSE_EVENT","prompt_delivery_event_id":"P1V0-RUN-0019:P1V0-S-0025:E1_GENERIC_IMMEDIATE_RESPONSE_PROMPT_DELIVERY","response_event_id":"P1V0-RUN-0019:P1V0-S-0025:R1_IMMEDIATE_RESPONSE_EVENT"},{"authority":"LINKS_SCRIPTED_RESPONSE_RECORD_TO_SCRIPTED_DELIVERY_CONTEXT_ONLY","context_delivery_event_ids":["P1V0-RUN-0019:P1V0-S-0025:E0_INITIAL_VIGNETTE_DELIVERY","P1V0-RUN-0019:P1V0-S-0025:E2_MATCHED_FUTURE_OPTION_DELIVERY"],"context_payload_sha256":["a515a6eb0cae606850fe78cf0eeb96c78fa4da674799d9eca16c5f230b6de26c","9415bc1dea8950240d4c7efc116fb24658c4a82276df8025cfb49fc80519ffaa"],"delivered_prompt_sha256":"aa183e93b71383358997a7dafdcc6001c9ef6f4191c8c3681a691c947a2935e5","link_id":"P1V0-RUN-0019:P1V0-S-0025:link:R2_LATER_RESPONSE_EVENT","prompt_delivery_event_id":"P1V0-RUN-0019:P1V0-S-0025:E3_GENERIC_LATER_RESPONSE_PROMPT_DELIVERY","response_event_id":"P1V0-RUN-0019:P1V0-S-0025:R2_LATER_RESPONSE_EVENT"},{"authority":"LINKS_SCRIPTED_RESPONSE_RECORD_TO_SCRIPTED_DELIVERY_CONTEXT_ONLY","context_delivery_event_ids":["P1V0-RUN-0019:P1V0-S-0025:E0_INITIAL_VIGNETTE_DELIVERY","P1V0-RUN-0019:P1V0-S-0025:E2_MATCHED_FUTURE_OPTION_DELIVERY"],"context_payload_sha256":["a515a6eb0cae606850fe78cf0eeb96c78fa4da674799d9eca16c5f230b6de26c","9415bc1dea8950240d4c7efc116fb24658c4a82276df8025cfb49fc80519ffaa"],"delivered_prompt_sha256":"26983c700c89ced0b2e017e050f4ef978b465d23144d06c596461fe4f260cf77","link_id":"P1V0-RUN-0019:P1V0-S-0025:link:RD0_RETROSPECTIVE_DIAGNOSTIC_RESPONSE_EVENT","prompt_delivery_event_id":"P1V0-RUN-0019:P1V0-S-0025:D0_POST_TRACE_DIAGNOSTIC_PROMPT_DELIVERY","response_event_id":"P1V0-RUN-0019:P1V0-S-0025:RD0_RETROSPECTIVE_DIAGNOSTIC_RESPONSE_EVENT"}],"session_id":"P1V0-S-0025","source_cell_id":"risk-001"}],"source_kind":"SCRIPTED_ADVERSARIAL_RESPONSE","status":"IMMUTABLE_SCRIPTED_REPLAY_NO_ACTUAL_OCCURRENCE_OR_MECHANISM_RESULT"}