{"$schema":"./run.schema.json","artifact_type":"DEVELOPMENT_ELICITATION_SCRIPTED_REPLAY","authority":{"artifact_role":"DEVELOPMENT_ELICITATION_SCRIPTED_REPLAY_ARTIFACT","defect_status":"NO_DEFECT_CLASSIFICATION_EMITTED","empirical_status":"NO_ACTUAL_PARTICIPANT_OCCURRENCE_OR_HUMAN_MECHANISM_SUPPORT","mapping_status":"NO_MAPPING_EMITTED","response_authority":"SCRIPTED_RESPONSE_RECORD_AND_PAYLOAD_PROVENANCE_ONLY"},"instrument_binding":{"content_sha256":"52705bc686a69d43360eb0544eda59571c77dc1e29520ec4b156bcd60f413776","instrument_id":"INTERP-DIALOGUE-001P0-ELICITATION-INSTRUMENT-V0","instrument_version":"0.0.0"},"run_id":"P1V0-RUN-0022","schema_version":"1.0.0","session_input_sha256":"c7ba4abda557272471e5c66595257417202940c64fe930c7486f1c8d2c891329","sessions":[{"comparison_binding":{"status":"NOT_APPLICABLE"},"event_log":[{"authority":"SCRIPTED_DELIVERY_RECORD_NOT_ACTUAL_OCCURRENCE_OR_ORDINAL_OBSERVATION","elicitation_step_id":"E0_INITIAL_VIGNETTE_DELIVERY","event_id":"P1V0-RUN-0022:P1V0-S-0028:E0_INITIAL_VIGNETTE_DELIVERY","event_kind":"STIMULUS_DELIVERY","payload_record":{"byte_length":477,"content_sha256":"522ec01b0a219e4025208ff19800f7db9eff815a6dbabbacf1742de2c4bbba4e","encoding":"BASE64_OF_EXACT_UTF8_BYTES","normalization":"NONE","raw_payload_utf8_base64":"QXQgbmlnaHQgb24gYSBwdWJsaWMgcm91dGUsIGZvb3RzdGVwcyBhcmUgYXVkaWJsZSBiZWhpbmQgdGhlIHdhbGtlcjsgdGhlaXIgc291cmNlIGlzIG5vdCB2aXNpYmxlLgoKQ29udGV4dDoKLSBJbW1lZGlhdGVseSBiZWZvcmUgaGVhcmluZyB0aGUgZm9vdHN0ZXBzLCB0aGUgd2Fsa2VyIHJlcG9ydHMgaGlnaCBib2RpbHkgYXJvdXNhbC4KLSBXaXRoaW4gdGhlIHNhbWUgcHJpb3Itd2VlayB3aW5kb3csIHRoZSB2aWduZXR0ZSBzdGF0ZXMgdGhhdCBubyBpbmNpZGVudCBvZiBiZWluZyBmb2xsb3dlZCBvciB0aHJlYXRlbmVkIG9jY3VycmVkLgotIEFjcm9zcyB0aGUgZml4ZWQgb2JzZXJ2YXRpb24gd2luZG93LCB0aGUgc2FtZSBudW1iZXIsIHRpbWluZywgZHVyYXRpb24sIGFuZCBsb3VkbmVzcyBvZiBmb290c3RlcHMgaXMgaGVhcmQsIGFuZCB0aGUgc291cmNlIHJlbWFpbnMgYmVoaW5kIGFmdGVyIHRoZSB3YWxrZXIncyB0d28gdHVybnMu","status":"PRESENT"},"sequence_ordinal":0},{"authority":"SCRIPTED_DELIVERY_RECORD_NOT_ACTUAL_OCCURRENCE_OR_ORDINAL_OBSERVATION","elicitation_step_id":"E1_GENERIC_IMMEDIATE_RESPONSE_PROMPT_DELIVERY","event_id":"P1V0-RUN-0022:P1V0-S-0028:E1_GENERIC_IMMEDIATE_RESPONSE_PROMPT_DELIVERY","event_kind":"PROMPT_DELIVERY","payload_record":{"byte_length":107,"content_sha256":"98ac7591e5d8c5db1dc3c68a521f6afb097a175d38961579603be9e6501f7ef0","encoding":"BASE64_OF_EXACT_UTF8_BYTES","normalization":"NONE","raw_payload_utf8_base64":"V2hhdCBpcyB0aGUgZmlyc3QgdGhpbmcgdGhlIHBlcnNvbiB3b3VsZCBzYXkgb3IgZG8gbmV4dD8gUmVzcG9uZCBmcmVlbHk7IHRoZXJlIGlzIG5vIHNpbmdsZSBjb3JyZWN0IGFuc3dlci4=","status":"PRESENT"},"sequence_ordinal":1},{"authority":"SCRIPTED_RESPONSE_RECORD_AND_PAYLOAD_PROVENANCE_ONLY","elicitation_step_id":"R1_IMMEDIATE_RESPONSE_EVENT","event_id":"P1V0-RUN-0022:P1V0-S-0028:R1_IMMEDIATE_RESPONSE_EVENT","event_kind":"SCRIPTED_RESPONSE_RECORD","payload_record":{"reason":"NO_RESPONSE","status":"ABSENT"},"prompt_delivery_event_id":"P1V0-RUN-0022:P1V0-S-0028:E1_GENERIC_IMMEDIATE_RESPONSE_PROMPT_DELIVERY","response_status":"NO_RESPONSE","sequence_ordinal":2},{"authority":"SCRIPTED_DELIVERY_RECORD_NOT_ACTUAL_OCCURRENCE_OR_ORDINAL_OBSERVATION","elicitation_step_id":"E2_MATCHED_FUTURE_OPTION_DELIVERY","event_id":"P1V0-RUN-0022:P1V0-S-0028:E2_MATCHED_FUTURE_OPTION_DELIVERY","event_kind":"STIMULUS_DELIVERY","payload_record":{"byte_length":60,"content_sha256":"5ded655481c4b29b383c93ee59e4e4ec22771e12098ad978644140f63444ece0","encoding":"BASE64_OF_EXACT_UTF8_BYTES","normalization":"NONE","raw_payload_utf8_base64":"VGhlIHNvdXJjZSBwYXNzZXMgdGhlIHdhbGtlciBhbmQgY29udGludWVzIG9uIGFub3RoZXIgcm91dGUu","status":"PRESENT"},"sequence_ordinal":3},{"authority":"SCRIPTED_DELIVERY_RECORD_NOT_ACTUAL_OCCURRENCE_OR_ORDINAL_OBSERVATION","elicitation_step_id":"E3_GENERIC_LATER_RESPONSE_PROMPT_DELIVERY","event_id":"P1V0-RUN-0022:P1V0-S-0028:E3_GENERIC_LATER_RESPONSE_PROMPT_DELIVERY","event_kind":"PROMPT_DELIVERY","payload_record":{"byte_length":130,"content_sha256":"aa183e93b71383358997a7dafdcc6001c9ef6f4191c8c3681a691c947a2935e5","encoding":"BASE64_OF_EXACT_UTF8_BYTES","normalization":"NONE","raw_payload_utf8_base64":"QWZ0ZXIgdGhpcyBhZGRpdGlvbmFsIGV2ZW50LCB3aGF0IGlzIHRoZSBuZXh0IHRoaW5nIHRoZSBwZXJzb24gd291bGQgc2F5IG9yIGRvPyBSZXNwb25kIGZyZWVseTsgdGhlcmUgaXMgbm8gc2luZ2xlIGNvcnJlY3QgYW5zd2VyLg==","status":"PRESENT"},"sequence_ordinal":4},{"authority":"SCRIPTED_RESPONSE_RECORD_AND_PAYLOAD_PROVENANCE_ONLY","elicitation_step_id":"R2_LATER_RESPONSE_EVENT","event_id":"P1V0-RUN-0022:P1V0-S-0028:R2_LATER_RESPONSE_EVENT","event_kind":"SCRIPTED_RESPONSE_RECORD","payload_record":{"byte_length":203,"content_sha256":"ca2c8ffed265b433aa67c84168582cec266485628596018a16feb9818b31f77d","encoding":"BASE64_OF_EXACT_UTF8_BYTES","normalization":"NONE","raw_payload_utf8_base64":"SXQgZGVwZW5kcy4gSWYgdGhleSBsZWFuIG9uIHRoZSBoaXN0b3J5LCB0aGV5IHdvdWxkIHNpbXBseSBhZ3JlZSBhbmQgd2FpdC4gSWYgdGhlIGxvdyBtb29kIGRvbWluYXRlcywgdGhleSBtaWdodCBhc2sgb25lIGNoZWNraW5nIHF1ZXN0aW9uIGZpcnN0LiBCb3RoIGNvbnRpbnVhdGlvbnMgc2VlbSBsaXZlIHRvIG1lIGFuZCBJIGNhbm5vdCBwaWNrIG9uZS4=","status":"PRESENT"},"prompt_delivery_event_id":"P1V0-RUN-0022:P1V0-S-0028:E3_GENERIC_LATER_RESPONSE_PROMPT_DELIVERY","response_status":"RESPONDED","sequence_ordinal":5},{"authority":"SCRIPTED_DELIVERY_RECORD_NOT_ACTUAL_OCCURRENCE_OR_ORDINAL_OBSERVATION","elicitation_step_id":"D0_POST_TRACE_DIAGNOSTIC_PROMPT_DELIVERY","event_id":"P1V0-RUN-0022:P1V0-S-0028:D0_POST_TRACE_DIAGNOSTIC_PROMPT_DELIVERY","event_kind":"PROMPT_DELIVERY","payload_record":{"byte_length":100,"content_sha256":"26983c700c89ced0b2e017e050f4ef978b465d23144d06c596461fe4f260cf77","encoding":"BASE64_OF_EXACT_UTF8_BYTES","normalization":"NONE","raw_payload_utf8_base64":"QWZ0ZXIgY29tcGxldGluZyBib3RoIHJlc3BvbnNlcywgYnJpZWZseSBub3RlIHdoaWNoIGRldGFpbHMgb2YgdGhlIHNjZW5hcmlvIGluZmx1ZW5jZWQgeW91ciBhbnN3ZXJzLg==","status":"PRESENT"},"sequence_ordinal":6},{"authority":"SCRIPTED_RESPONSE_RECORD_AND_PAYLOAD_PROVENANCE_ONLY","elicitation_step_id":"RD0_RETROSPECTIVE_DIAGNOSTIC_RESPONSE_EVENT","event_id":"P1V0-RUN-0022:P1V0-S-0028:RD0_RETROSPECTIVE_DIAGNOSTIC_RESPONSE_EVENT","event_kind":"SCRIPTED_RESPONSE_RECORD","payload_record":{"byte_length":193,"content_sha256":"3bb066233284b499bda7df9709e05f40a9081f6d7cd51a8c039cc5099eb2dd8f","encoding":"BASE64_OF_EXACT_UTF8_BYTES","normalization":"NONE","raw_payload_utf8_base64":"VGhpbmtpbmcgYmFjaywgSSBwcm9iYWJseSBhbnN3ZXJlZCB0aGF0IHdheSBiZWNhdXNlIHRoZSBwZXJzb24gc2VlbWVkIGluc2VjdXJlIOKAlCB0aG91Z2ggdGhlIHNjZW5hcmlvIG5ldmVyIHNheXMgdGhhdCwgYW5kIEkgbm90aWNlIEkgYW0gaW52ZW50aW5nIGEgbW90aXZlIHJpZ2h0IG5vdyByYXRoZXIgdGhhbiByZWNhbGxpbmcgb25lLg==","status":"PRESENT"},"prompt_delivery_event_id":"P1V0-RUN-0022:P1V0-S-0028:D0_POST_TRACE_DIAGNOSTIC_PROMPT_DELIVERY","response_status":"RESPONDED","sequence_ordinal":7}],"future_option_id":"FUTURE-RISK-0","presentation_id":"PRES-RISK-101-EN-V0","response_provenance_links":[{"authority":"LINKS_SCRIPTED_RESPONSE_RECORD_TO_SCRIPTED_DELIVERY_CONTEXT_ONLY","context_delivery_event_ids":["P1V0-RUN-0022:P1V0-S-0028:E0_INITIAL_VIGNETTE_DELIVERY"],"context_payload_sha256":["522ec01b0a219e4025208ff19800f7db9eff815a6dbabbacf1742de2c4bbba4e"],"delivered_prompt_sha256":"98ac7591e5d8c5db1dc3c68a521f6afb097a175d38961579603be9e6501f7ef0","link_id":"P1V0-RUN-0022:P1V0-S-0028:link:R1_IMMEDIATE_RESPONSE_EVENT","prompt_delivery_event_id":"P1V0-RUN-0022:P1V0-S-0028:E1_GENERIC_IMMEDIATE_RESPONSE_PROMPT_DELIVERY","response_event_id":"P1V0-RUN-0022:P1V0-S-0028:R1_IMMEDIATE_RESPONSE_EVENT"},{"authority":"LINKS_SCRIPTED_RESPONSE_RECORD_TO_SCRIPTED_DELIVERY_CONTEXT_ONLY","context_delivery_event_ids":["P1V0-RUN-0022:P1V0-S-0028:E0_INITIAL_VIGNETTE_DELIVERY","P1V0-RUN-0022:P1V0-S-0028:E2_MATCHED_FUTURE_OPTION_DELIVERY"],"context_payload_sha256":["522ec01b0a219e4025208ff19800f7db9eff815a6dbabbacf1742de2c4bbba4e","5ded655481c4b29b383c93ee59e4e4ec22771e12098ad978644140f63444ece0"],"delivered_prompt_sha256":"aa183e93b71383358997a7dafdcc6001c9ef6f4191c8c3681a691c947a2935e5","link_id":"P1V0-RUN-0022:P1V0-S-0028:link:R2_LATER_RESPONSE_EVENT","prompt_delivery_event_id":"P1V0-RUN-0022:P1V0-S-0028:E3_GENERIC_LATER_RESPONSE_PROMPT_DELIVERY","response_event_id":"P1V0-RUN-0022:P1V0-S-0028:R2_LATER_RESPONSE_EVENT"},{"authority":"LINKS_SCRIPTED_RESPONSE_RECORD_TO_SCRIPTED_DELIVERY_CONTEXT_ONLY","context_delivery_event_ids":["P1V0-RUN-0022:P1V0-S-0028:E0_INITIAL_VIGNETTE_DELIVERY","P1V0-RUN-0022:P1V0-S-0028:E2_MATCHED_FUTURE_OPTION_DELIVERY"],"context_payload_sha256":["522ec01b0a219e4025208ff19800f7db9eff815a6dbabbacf1742de2c4bbba4e","5ded655481c4b29b383c93ee59e4e4ec22771e12098ad978644140f63444ece0"],"delivered_prompt_sha256":"26983c700c89ced0b2e017e050f4ef978b465d23144d06c596461fe4f260cf77","link_id":"P1V0-RUN-0022:P1V0-S-0028:link:RD0_RETROSPECTIVE_DIAGNOSTIC_RESPONSE_EVENT","prompt_delivery_event_id":"P1V0-RUN-0022:P1V0-S-0028:D0_POST_TRACE_DIAGNOSTIC_PROMPT_DELIVERY","response_event_id":"P1V0-RUN-0022:P1V0-S-0028:RD0_RETROSPECTIVE_DIAGNOSTIC_RESPONSE_EVENT"}],"session_id":"P1V0-S-0028","source_cell_id":"risk-101"}],"source_kind":"SCRIPTED_ADVERSARIAL_RESPONSE","status":"IMMUTABLE_SCRIPTED_REPLAY_NO_ACTUAL_OCCURRENCE_OR_MECHANISM_RESULT"}